,artwork_id,title,creation_year_start,creation_year_end,medium,genre,dimension,full_image_url,display_name,last_name,birth_year,death_year,nationality,location,source,mediums,surfaces,original_url,compressed_url,thumbnail_url,intro,overview,style,style_tags,theme,theme_tags,main_objects,other_objects,movements,artist_family_name,artist_given_name,object_tags,tags,artist_display
5601,MET-ada1bd2c-467d-48b4-9371-310cdb55d4a3,Landscape,1368.0,1911.0,Handscroll; ink and color on paper,Painting,20 1/4 in. × 31 ft. 3 1/2 in. (51.4 × 953.8 cm),https://images.metmuseum.org/CRDImages/as/original/DP166135_CRD.jpg,Unidentified artist,artist,,,Unknown,Unknown,MET,"['Ink', 'Color']","['Handscroll', 'Paper']",https://aicurator.blob.core.windows.net/artwork-images/original/MET-ada1bd2c-467d-48b4-9371-310cdb55d4a3.jpg,https://aicurator.blob.core.windows.net/artwork-images/compressed/MET-ada1bd2c-467d-48b4-9371-310cdb55d4a3.jpg,https://aicurator.blob.core.windows.net/artwork-images/thumbnails/MET-ada1bd2c-467d-48b4-9371-310cdb55d4a3.jpg,Serene mountains envelop ancient architecture.,"The artwork depicts a mountainous landscape with delicate trees and traditional architecture nestled within. The earthy tones and subtle details create a tranquil, harmonious scene.","The landscape is painted with fine, precise brushwork characteristic of East Asian ink paintings. The composition balances nature and architecture, using muted, earthy colors to enhance the sense of tranquility and timelessness. The meticulous attention to detail in the foliage and structures exemplifies traditional techniques, blending realism with an idealized perspective.","['East Asian', 'ink painting', 'landscape']","This artwork explores the harmony between nature and human-made structures, emphasizing peace and simplicity. It suggests a profound connection between the natural environment and human existence.","['nature', 'harmony', 'tranquility']","{'mountains': 'The mountains dominate the background, conveying a sense of majesty and permanence.', 'trees': 'Intricately drawn trees populate the landscape, adding life and texture to the scenery.', 'traditional architecture': 'Nestled amidst the mountains, the architecture suggests a historical or spiritual significance.'}",[],['Asian landscape painting'],,,"['mountains', 'trees', 'traditional architecture']","['East Asian', 'Ink', 'Landscape', 'Nature', 'Harmony', 'Tranquility', 'Mountains', 'Trees', 'Traditional Architecture', 'East Asian Landscape']",Unknown
1633,ARTIC-f521c3d4-4ced-a6a0-6836-e12e48cb0a9f,The Death of Orpheus,1865.0,1875.0,Oil on canvas,Painting,46.5 × 55.8 cm (18 3/16 × 21 15/16 in.),https://www.artic.edu/iiif/2/f521c3d4-4ced-a6a0-6836-e12e48cb0a9f/full/max/0/default.jpg,"Henri Leopold Lévy (French, 1840-1904)",,1840.0,1904.0,French,France,ARTIC,['Oil'],['Canvas'],https://aicurator.blob.core.windows.net/artwork-images/original/ARTIC-f521c3d4-4ced-a6a0-6836-e12e48cb0a9f.jpg,https://aicurator.blob.core.windows.net/artwork-images/compressed/ARTIC-f521c3d4-4ced-a6a0-6836-e12e48cb0a9f.jpg,https://aicurator.blob.core.windows.net/artwork-images/thumbnails/ARTIC-f521c3d4-4ced-a6a0-6836-e12e48cb0a9f.jpg,A haunting depiction of Orpheus's tragic demise.,"The artwork captures the lifeless body of Orpheus on a riverbank, with his severed head floating nearby. The water churns with movement, and the surrounding landscape is somber and rocky, enhancing the tragic theme.","The painting exhibits a dramatic and emotive style, typical of 19th-century Romanticism. The use of dark, muted colors, and fluid brushstrokes evoke a sense of melancholy and desolation. The composition draws focus to the forlorn figure and the flowing river, embodying the chaos and sorrow of Orpheus’s death while the cloudy sky enhances the mood. The detailed rendering of natural elements and expressive figures highlights the emotional intensity and narrative depth.","['Romanticism', 'dramatic', 'emotive', 'dark']","The painting explores themes of tragedy, loss, and the ephemeral nature of life. It portrays the mythological story of Orpheus, suggesting deeper reflections on mortality and the power of art and music, mirrored by the presence of his lyre.","['tragedy', 'mortality', 'mythology', 'loss']","{'Orpheus': 'Orpheus lies lifeless by the riverbank, clutching his lyre, symbolizing the end of his musical legacy.', ""Orpheus's head"": 'Floating downstream, his severed head is surrounded by a halo-like glow, emphasizing his tragic end.', 'River': ""The river's turbulent waters reflect the chaos and sorrow of the scene, moving swiftly past Orpheus's body.""}","['birds', 'rocky landscape', 'distant mountains']",['Romanticism'],Lévy,Henri Leopold,"['Orpheus', ""Orpheus's head"", 'River', 'birds', 'rocky landscape', 'distant mountains']","['Romanticism', 'Dramatic', 'Emotive', 'Dark', 'Tragedy', 'Mortality', 'Mythology', 'Loss', 'River', 'Birds', 'Rocky Landscape', 'Distant Mountains']",Lévy Henri Leopold
851,ARTIC-791abe16-d00a-577b-fbae-5a6a1e4f70ac,Korean Buddhist Painting,1701.0,1800.0,Ink and color on hemp cloth,Painting,,https://www.artic.edu/iiif/2/791abe16-d00a-577b-fbae-5a6a1e4f70ac/full/max/0/default.jpg,Korea,,,,Korean,Korea,ARTIC,"['Ink', 'Color']",['Cloth'],https://aicurator.blob.core.windows.net/artwork-images/original/ARTIC-791abe16-d00a-577b-fbae-5a6a1e4f70ac.jpg,https://aicurator.blob.core.windows.net/artwork-images/compressed/ARTIC-791abe16-d00a-577b-fbae-5a6a1e4f70ac.jpg,https://aicurator.blob.core.windows.net/artwork-images/thumbnails/ARTIC-791abe16-d00a-577b-fbae-5a6a1e4f70ac.jpg,A serene assembly of celestial beings.,"The painting depicts a group of Buddhist deities, each with serene expressions and elaborate halos. Their robes are adorned with intricate details, using a palette of earthy greens, reds, and golds. The figures are positioned in a harmonious arrangement, indicating their spiritual significance.","This artwork showcases traditional Korean Buddhist painting techniques, often characterized by meticulous detailing and harmonious color palettes. The use of flowing lines and rich, deep colors highlights the divine nature of the figures. The ornate halos emphasize their spiritual enlightenment, while the gentle expressions invoke a sense of peace and reverence.","['traditional', 'Korean', 'Buddhist']","The painting centers on spirituality and enlightenment, portraying divine figures in a calm and otherworldly manner. It reflects Buddhist teachings and the transcendence of earthly concerns.","['spirituality', 'enlightenment', 'divinity']","{'Buddhist deities': 'A group of serene-faced deities with halos, representing spiritual wisdom and divine presence.'}","['halos', 'robes']",['Buddhist art'],,,"['Buddhist deities', 'halos', 'robes']","['Traditional', 'Korean', 'Buddhist', 'Spirituality', 'Enlightenment', 'Divinity', 'Halos', 'Robes']",Unknown
5396,MET-749a65c8-f654-4a35-975e-0ad852cf9acb,Landscape,1823.0,1886.0,Folding fan mounted as an album leaf; ink and color on gold-flecked paper,Painting,7 1/8 x 20 1/4 in. (18.1 x 51.4 cm),https://images.metmuseum.org/CRDImages/as/original/DP161404.jpg,Hu Yuan,Yuan,1823.0,1886.0,Chinese,China,MET,"['Ink', 'Color', 'Gold']","['Fan', 'Album', 'Paper']",https://aicurator.blob.core.windows.net/artwork-images/original/MET-749a65c8-f654-4a35-975e-0ad852cf9acb.jpg,https://aicurator.blob.core.windows.net/artwork-images/compressed/MET-749a65c8-f654-4a35-975e-0ad852cf9acb.jpg,https://aicurator.blob.core.windows.net/artwork-images/thumbnails/MET-749a65c8-f654-4a35-975e-0ad852cf9acb.jpg,A serene and intricate landscape painting.,"The painting depicts a tranquil mountainous landscape. Bare trees dot the mountainside, with a solitary hut nestled among them. A lone boatman rows on a distant river.","Hu Yuan employs expressive brushwork with soft ink washes, capturing the subtlety of nature. The composition, spread across a fan-shaped canvas, offers a panoramic view of the serene environment, evoking a sense of calm and introspection.","['traditional', 'Chinese', 'landscape', 'ink wash']","The artwork reflects the harmony and tranquility of nature, emphasizing simplicity and the beauty found in solitude and contemplation.","['nature', 'solitude', 'harmony', 'tranquility']","{'mountains': 'Broad, rhythmic forms defining the landscape, evoking strength and stability.', 'trees': ""Leafless, scattered across the scene, emphasizing the season's barrenness and elegance."", 'hut': 'Small and isolated, representing simplicity and solitude in the vast landscape.', 'boat': 'Tiny with a lone rower, embodies movement and exploration amid stillness.'}",[],['Chinese landscape painting'],Hu,Yuan,"['mountains', 'trees', 'hut', 'boat']","['Traditional', 'Chinese', 'Landscape', 'Ink Wash', 'Nature', 'Solitude', 'Harmony', 'Tranquility', 'Mountains', 'Trees', 'Hut', 'Boat', 'Chinese Landscape']",Hu Yuan
2875,NGA-7c8d0489-241c-4645-8f95-6dd764d43626,The End of the Hunt,1800.0,1800.0,Oil on canvas,Painting,"overall: 87.6 x 136.8 cm (34 1/2 x 53 7/8 in.)
framed: 114 x 162.2 x 3.9 cm (44 7/8 x 63 7/8 x 1 9/16 in.)",https://api.nga.gov/iiif/7c8d0489-241c-4645-8f95-6dd764d43626/full/max/0/default.jpg,American 19th Century,American 19th Century,1800.0,1899.0,American,United States,NGA,['Oil'],['Canvas'],https://aicurator.blob.core.windows.net/artwork-images/original/NGA-7c8d0489-241c-4645-8f95-6dd764d43626.jpg,https://aicurator.blob.core.windows.net/artwork-images/compressed/NGA-7c8d0489-241c-4645-8f95-6dd764d43626.jpg,https://aicurator.blob.core.windows.net/artwork-images/thumbnails/NGA-7c8d0489-241c-4645-8f95-6dd764d43626.jpg,Dynamic rural hunting scene in the countryside.,"The artwork captures a lively hunting scene with multiple figures on horseback and a pack of hounds. The riders wear traditional hunting attire, and a varied landscape with trees and a farmhouse is visible in the background. The scene is bustling with movement as dogs leap over a wooden fence in the foreground.","The painting employs a folk art style, typical of American 19th-century works. It uses bright, earthy tones and a simple composition to depict everyday life. The brushstrokes are straightforward and functional, emphasizing action and narrative over realism. The naive, untutored style contributes to its charm and provides an authentic glimpse into the period's cultural practices.","['folk art', 'naive', 'rural', 'narrative']","The theme explores tradition and the thrill of the hunt, emphasizing human interaction with nature. It highlights camaraderie and the excitement of rural life pursuits.","['tradition', 'nature', 'rural', 'hunting']","{'horses': 'Several horses are depicted in motion, ridden by hunters, showcasing the energy and pace of the hunt.', 'hounds': 'A pack of hounds energetically pursue their quarry, jumping over fences, adding dynamism to the scene.', 'hunters': 'Hunters in typical period attire ride their horses, guiding the pack and showcasing hunting skills.'}","['farmhouse', 'trees', 'fence', 'field']",['American folk art'],,,"['horses', 'hounds', 'hunters', 'farmhouse', 'trees', 'fence', 'field']","['Folk', 'Naive', 'Rural', 'Narrative', 'Tradition', 'Nature', 'Hunting', 'Horses', 'Hunters', 'Farmhouse', 'Trees', 'Fence', 'Field', 'American Folk']",Unknown
698,ARTIC-60699af7-9aab-5e2b-7309-1266286b0810,Portrait of a Musician,1745.0,1750.0,Oil on canvas,Painting,144.5 × 104.6 cm (56 7/8 × 41 3/16 in.); Framed: 162 × 123.9 × 14 cm (63 3/4 × 48 3/4 × 5 1/2 in.),https://www.artic.edu/iiif/2/60699af7-9aab-5e2b-7309-1266286b0810/full/max/0/default.jpg,"Alessandro Longhi (Italian, 1733-1813)",,1733.0,1813.0,Italian,Italy,ARTIC,['Oil'],['Canvas'],https://aicurator.blob.core.windows.net/artwork-images/original/ARTIC-60699af7-9aab-5e2b-7309-1266286b0810.jpg,https://aicurator.blob.core.windows.net/artwork-images/compressed/ARTIC-60699af7-9aab-5e2b-7309-1266286b0810.jpg,https://aicurator.blob.core.windows.net/artwork-images/thumbnails/ARTIC-60699af7-9aab-5e2b-7309-1266286b0810.jpg,An elegant portrayal of a Baroque musician.,"A musician sits gracefully, elegantly dressed in rich, flowing fabrics. He holds a sheet of music, gazing out with a serene expression. Instruments lie on the table beside him.","The portrait features a refined Rococo style, showcasing delicate brushwork and a gentle, harmonious color palette dominated by soft pastels and warm tones. The composition is balanced, capturing both the subject’s dignity and opulence, characteristic of the era’s portraiture.","['Rococo', 'Baroque', 'portraiture']","The artwork highlights themes of elegance, cultural refinement, and the esteemed status of musicians during the Baroque period.","['elegance', 'music', 'refinement']","{'musician': 'The seated musician exudes grace, clothed in richly detailed fabrics. His expression is thoughtful, perhaps reflecting on his music.', 'sheet_music': 'Held delicately by the musician, the sheet music signifies his profession and artistic focus.', 'musical_instruments': 'A violin and wind instruments rest nearby, symbolizing his skill and musical interest.'}","['chair', 'ink pot']","['Rococo', 'Baroque']",Longhi,Alessandro,"['musician', 'sheet_music', 'musical_instruments', 'chair', 'ink pot']","['Rococo', 'Baroque', 'Portraiture', 'Elegance', 'Music', 'Refinement', 'Musician', 'Musical_Instruments', 'Chair']",Longhi Alessandro
413,ARTIC-3aa79682-996a-0ce4-f2dc-3eb802e9d503,A Pair of Carp,1392.0,1910.0,Ink and colors on paper,Painting,106.3 × 41.9 cm (41 7/8 × 16 1/2 in.),https://www.artic.edu/iiif/2/3aa79682-996a-0ce4-f2dc-3eb802e9d503/full/max/0/default.jpg,Korea,,,,Korean,Korea,ARTIC,['Ink'],['Paper'],https://aicurator.blob.core.windows.net/artwork-images/original/ARTIC-3aa79682-996a-0ce4-f2dc-3eb802e9d503.jpg,https://aicurator.blob.core.windows.net/artwork-images/compressed/ARTIC-3aa79682-996a-0ce4-f2dc-3eb802e9d503.jpg,https://aicurator.blob.core.windows.net/artwork-images/thumbnails/ARTIC-3aa79682-996a-0ce4-f2dc-3eb802e9d503.jpg,Elegant depiction of two serene carp in aquatic surroundings.,"The artwork presents a pair of carp swimming gracefully amidst delicate aquatic vegetation. The soft, muted colors and intricate detailing give a sense of tranquility and harmony in a natural setting.","This artwork showcases traditional East Asian ink wash painting techniques, with fine, expressive lines and soft, flowing brushwork. The gentle tonal variations create a harmonious composition, evoking a sense of calm. The use of minimal color emphasizes the contrast and texture of the fish scales, giving the painting a serene, yet dynamic, feel.","['ink wash', 'traditional', 'East Asian']","The painting explores themes of nature and tranquility, expressing a deep appreciation for the harmonious beauty of aquatic life.","['nature', 'tranquility', 'harmony']","{'carp_1': 'The fish is oriented downward, with its body elegantly curved. Its scales are meticulously detailed.', 'carp_2': 'A second carp swims upward, subtly mirroring the first, enhancing the painting’s symmetry.'}",['aquatic vegetation'],['traditional East Asian art'],,,"['carp_1', 'carp_2', 'aquatic vegetation']","['Ink Wash', 'Traditional', 'East Asian', 'Nature', 'Tranquility', 'Harmony', 'Traditional East Asian']",Unknown
3334,NGA-ad117357-25b4-4058-b01a-7ea0db281ea0,Café Singer,1917.0,1917.0,Oil on canvas,Painting,"overall: 92.4 x 60.3 cm (36 3/8 x 23 3/4 in.)
framed: 112.4 x 80.3 cm (44 1/4 x 31 5/8 in.)",https://api.nga.gov/iiif/ad117357-25b4-4058-b01a-7ea0db281ea0/full/max/0/default.jpg,Amedeo Modigliani,Modigliani,1884.0,1920.0,Italian,Italy,NGA,['Oil'],['Canvas'],https://aicurator.blob.core.windows.net/artwork-images/original/NGA-ad117357-25b4-4058-b01a-7ea0db281ea0.jpg,https://aicurator.blob.core.windows.net/artwork-images/compressed/NGA-ad117357-25b4-4058-b01a-7ea0db281ea0.jpg,https://aicurator.blob.core.windows.net/artwork-images/thumbnails/NGA-ad117357-25b4-4058-b01a-7ea0db281ea0.jpg,A contemplative portrait by a renowned modern artist.,"The artwork depicts a seated woman with elongated features, dressed in black. Her somber expression and posture suggest introspection. The background is a muted, undefined space enhancing her isolation.","This painting features Modigliani’s signature style, characterized by elongated forms and simplified features. The color palette is subdued, with a focus on earthy tones. The brushstrokes are smooth yet deliberate, emphasizing the silhouette of the figure and drawing attention to the subject’s pose and expression. The overall composition is both graceful and melancholic, reflective of Modigliani’s modernist influences.","['Modernism', 'Expressionism', 'Portraiture']","The painting explores themes of solitude and introspection. The woman's expression and posture convey a sense of quiet reflection, capturing the depth of human emotion.","['Introspection', 'Solitude', 'Emotion']","{'woman': 'A woman with elongated facial features and a pensive expression, dressed in black, dominates the composition.'}",[],"['Modernism', 'Expressionism']",Modigliani,Amedeo,['woman'],"['Modernism', 'Expressionism', 'Portraiture', 'Introspection', 'Solitude', 'Emotion', 'Woman']",Modigliani Amedeo
