,title,artist_display,date_display,date_start,date_end,medium,image_id,url,intro,overview,style,style_tags,theme,theme_tags,main_objects,other_objects,movement,object_tags,tags
1014,Madonna and Child,"Anonymous Artist
Marco Zoppo (Paduan, 1433-1478)
Possibly Marco Zoppo (Paduan, 1433-1478)",c. 1467/1468,1467.0,1468.0,Tempera on poplar panel,NGA-05e6ca89-e950-4ff7-8463-50f553ce2ad6,"https://api.nga.gov/iiif/05e6ca89-e950-4ff7-8463-50f553ce2ad6/full/1686,/0/default.jpg",A classical representation of religious affection between a mother and child.,"The artwork portrays the Virgin Mary in a blue robe holding the Christ Child who stands confidently on a parapet. Mary looks down towards her son with a gentle, serene expression, supporting him with her hands. The sky in the background is clear with only a few wisps of clouds, highlighting the figures in the foreground.","This artwork reflects the characteristics of the Italian Renaissance with its attention to lifelike details, vibrant colors, and depth. The figures are rendered with anatomical precision, and the drapery of Mary's robe displays a mastery of depicting fabric and form. There is a balance between realism and idealism in the faces. The background is simplistic, focusing attention on the subjects. The use of light and the detailed rendering of textures are also notable.","['Renaissance', 'Figurative', 'Italian Art', 'Religious', 'Classical', 'Realism', 'Idealism']","The theme centers around the Christian iconography of Madonna and Child, symbolizing purity, divine love, and motherhood. The intimacy and protective nature of the Virgin Mary, as well as the humanity of the Christ Child, are emphasized, representing theological concepts of incarnation and divine maternity.","['Madonna and Child', 'Christian Iconography', 'Purity', 'Divine Love', 'Motherhood', 'Theology', 'Incarnation']","{'Virgin Mary': 'Dressed in a rich blue robe, Virgin Mary emanates a sense of calmness and divinity, gazing down at her son with maternal affection.', 'Christ Child': 'The child Christ is depicted standing unnaturally poised on a parapet, reaching out to his mother, symbolizing his future as the savior.'}","['Parapet', 'Clouds', 'Halo', 'Robe']",['Renaissance'],"['Virgin Mary', 'Christ Child', 'Parapet', 'Clouds', 'Halo', 'Robe']","['Renaissance', 'Figurative', 'Italian', 'Religious', 'Classical', 'Realism', 'Madonna And Child', 'Christian Iconography', 'Purity', 'Motherhood', 'Theology', 'Virgin Mary', 'Christ Child', 'Clouds', 'Halo', 'Robe']"
2204,The Holy Family with Four Saints and a Female Donor,"Antonio Rimpatta (Italian, documented from 1509-died 1531/32)",c. 1510,1505.0,1515.0,Oil on panel,ARTIC-ed291bcf-adaa-4acb-aafb-c092b0fd8351,"https://www.artic.edu/iiif/2/ed291bcf-adaa-4acb-aafb-c092b0fd8351/full/1686,/0/default.jpg",A timeless religious tableau featuring the Holy Family accompanied by saints and a devoted observer.,"The painting displays the Virgin Mary holding the Christ child, joined by Joseph and four saints. The figures are portrayed with detailed expressions and draped in richly colored garments. A female figure, likely the donor of the artwork, is depicted in prayerful reverence to the side.","Antonio Rimpatta's style in this artwork is representative of Italian Renaissance painting. It features meticulous detail, especially in the depictions of faces and fabrics, demonstrating a keen interest in lifelike representation and human emotion. The use of color and light reflects the era's pursuit of naturalism, although the background remains dark to focus the viewer's attention on the figures.","['Italian Renaissance', 'Naturalism', 'Detail', 'Realism', 'Humanism', 'Figurative']","This artwork embodies religious devotion and iconography typical of the Renaissance period. The inclusion of the Holy Family, alongside saints and a patron, depicts a scene of veneration and points to the period's emphasis on religious patronage and narrative art.","['Religion', 'Christianity', 'The Holy Family', 'Saints', 'Devotion', 'Patronage', 'Narrative']","{'The Holy Family': 'Centrally featured, Mary holds the naked Christ child while Joseph watches over with solemnity.', 'Four Saints': 'Surrounding the Holy Family, each saint is uniquely identifiable through their attributes and posture.', 'Female Donor': 'Positioned at the lower right, she gazes upwards, prayerful and humble in her devotion.'}","['Garments', 'Halo', 'Chalice']",['Renaissance'],"['The Holy Family', 'Four Saints', 'Female Donor', 'Garments', 'Halo', 'Chalice']","['Italian Renaissance', 'Naturalism', 'Detail', 'Realism', 'Humanism', 'Figurative', 'Religion', 'Christianity', 'Holy Family', 'Saints', 'Devotion', 'Patronage', 'Narrative', 'Garments', 'Halo', 'Renaissance']"
1354,Martyrdom of Saint Margaret,"Giuseppe Cesari (Roman, 1568-1640)",c. 1608/1611,1608.0,1611.0,Oil on panel,NGA-eb807a2b-ff3f-4113-8617-d2575a2b4f2d,"https://api.nga.gov/iiif/eb807a2b-ff3f-4113-8617-d2575a2b4f2d/full/1686,/0/default.jpg",A vibrant depiction of Saint Margaret's transcendence amidst her impending martyrdom.,"The painting portrays the martyrdom of Saint Margaret, with her at the center, kneeling in prayer. The upper part shows heavenly figures, including the Virgin Mary, and saintly characters who are observing the scene below. The earthly realm below is filled with various figures, some of whom show aggression towards Margaret, while others seem indifferent to her plight. The contrast between the celestial calmness and the chaotic lower half highlights the central theme of martyrdom and spiritual elevation.","Giuseppe Cesari's work is rooted in the late Renaissance and early Baroque style. It presents a dramatic depiction with deep, vibrant colors and captures a moment of serene spirituality juxtaposed against worldly turmoil. The painting focuses on luminous figures and a dramatic contrast between light and shadow to emphasize the divine nature of the upper scene versus the human drama below. Delicate details and expressive faces are hallmarks of Cesari's emotive style.","['Renaissance', 'Baroque', 'Figurative', 'Chiaroscuro', 'Dramatic', 'Vibrant Colors']","The theme revolves around the Christian tradition of celebrating martyrdom as a pathway to sainthood and the heavenly realm. Saint Margaret's faith and martyrdom are central to this piece, presenting a narrative of spiritual victory and eternal peace being granted to the pure-hearted, even amidst earthly suffering and violence.","['Martyrdom', 'Christianity', 'Sainthood', 'Faith', 'Heavenly Reward', 'Spirituality']","{'Saint Margaret': 'Margaret is depicted as serene and detached, amidst her execution, praying with a divine glow around her.', 'Heavenly Figures': 'These include the Virgin Mary with infant Jesus, and saintly figures enveloped in a peaceful, blue clouded backdrop.', 'Persecutors': 'The earthly aggressors are shown with various expressions, some menacing, others retreating in horror.'}","['Armor', 'Weapons', 'Angels', 'Spectators', 'Dragon']","['Renaissance', 'Baroque']","['Saint Margaret', 'Heavenly Figures', 'Persecutors', 'Armor', 'Weapons', 'Angels', 'Spectators', 'Dragon']","['Renaissance', 'Baroque', 'Figurative', 'Chiaroscuro', 'Dramatic', 'Vibrant Colors', 'Martyrdom', 'Christianity', 'Faith', 'Spirituality', 'Armor', 'Weapons', 'Angels', 'Spectators']"
2435,Adam and Eve in Paradise,"Francesco Solimena (Italian, 1657-1747)",c. 1700,1695.0,1705.0,Oil on canvas,ARTIC-eba4ff21-3b90-801b-0f0a-1bd913b49049,"https://www.artic.edu/iiif/2/eba4ff21-3b90-801b-0f0a-1bd913b49049/full/1686,/0/default.jpg",A Baroque interpretation of the biblical figures Adam and Eve in the Garden of Eden.,"The painting depicts a scene from the biblical story of creation with Adam and Eve in the Garden of Eden. The figures of Adam and Eve are prominently placed in the center, surrounded by various animals, with a group of angels above in the clouds, symbolizing divine presence. The lush greenery sets the atmosphere of the abundant paradise.",Francesco Solimena's work showcases the dramatic expressions and rich color palette typical of the Baroque period. The emphasis on realism is evident in the detailed anatomical features of Adam and Eve and the naturalistic portrayal of the animals. Strong contrasts between light and shadow enhance the three-dimensionality of the figures and the space they occupy. The dynamic composition and flowing drapery of the angels reflect the theatricality associated with Baroque art.,"['Baroque', 'Dramatic', 'Contrast', 'Realism', 'Theatricality', 'Naturalism', 'Rich colors']","The theme centers around the biblical narrative of the origin of human sin through Adam and Eve's act of disobedience in the Garden of Eden. It explores concepts of innocence, temptation, and the relationship between humanity and the divine. The painting captures the moment before the fall, projecting an aura of serene perfection.","['Biblical', 'Creation', 'Innocence', 'Temptation', 'Humanity', 'Divinity', 'Paradise', 'Sin']","{'Adam': 'Adam is depicted with a thoughtful expression, sitting on a rock, looking towards Eve who stands beside him.', 'Eve': ""Eve stands gracefully, yet there's a hint of hesitation in her pose and expression as if contemplating their existence."", 'Angels': 'A group of angels float amongst clouds overhead, infusing the scene with a sense of heavenly oversight.'}","['Lions', 'Sheep', 'Dog', 'Peacock', 'Horse', 'Trees', 'Foliage', 'Clouds']",['Baroque'],"['Adam', 'Eve', 'Angels', 'Lions', 'Sheep', 'Dog', 'Peacock', 'Horse', 'Trees', 'Foliage', 'Clouds']","['Baroque', 'Dramatic', 'Contrast', 'Realism', 'Naturalism', 'Rich Colors', 'Biblical', 'Innocence', 'Temptation', 'Humanity', 'Divinity', 'Angels', 'Sheep', 'Dog', 'Horse', 'Trees', 'Foliage', 'Clouds']"
464,Madonna and Child with Angels,Ferrarese 15th Century,c. 1455/1470,1455.0,1470.0,Tempera on poplar panel,NGA-6cb74e73-7fb1-4a00-8932-5a791aa03358,"https://api.nga.gov/iiif/6cb74e73-7fb1-4a00-8932-5a791aa03358/full/1686,/0/default.jpg",A serene portrayal of religious figures with a detailed backdrop.,"This artwork features the Virgin Mary seated with the Christ Child asleep on her lap, surrounded by three attending angels. The background depicts a scenic landscape with rocky outcrops, a castle, and a body of water.","The painting is indicative of the Italian Renaissance style, characterized by its detailed realism, use of perspective, and religious iconography. The careful attention to the drapery of the garments, along with the use of vibrant colors and gold to highlight halos and embellishments, reflect the era's focus on lifelike representation and the significance of religious subjects. The landscape suggests an incorporation of naturalism into the divine narrative.","['Italian Renaissance', 'Realism', 'Naturalism', 'Perspective', 'Religious Iconography', 'Gold Leaf']","The central theme is religious, depicting Mary, the Mother of Jesus, and the Christ Child with attendant angels. It reflects the adoration and reverence for the Madonna and Child, a common subject in Christian art, symbolizing purity and divine love.","['Religion', 'Christianity', 'Madonna and Child', 'Angels', 'Reverence', 'Divinity']","{'Virgin Mary': 'Mary is depicted with a serene expression, hands clasped in prayer, wearing a blue mantle and a red dress, symbolizing purity and love.', 'Christ Child': ""The infant Jesus is shown asleep, laying across Mary's lap, portraying his vulnerability and humanity."", 'Angels': 'Three angels are shown with Mary, two on her left and one on her right, each with a unique pose and expression, participating in the adoration of the Christ Child.'}","['Castle', 'Landscape', 'Body of Water', 'Rocky Outcrops', 'Flora']",['Renaissance'],"['Virgin Mary', 'Christ Child', 'Angels', 'Castle', 'Landscape', 'Body of Water', 'Rocky Outcrops', 'Flora']","['Italian Renaissance', 'Realism', 'Naturalism', 'Perspective', 'Religious Iconography', 'Gold Leaf', 'Religion', 'Christianity', 'Madonna And Child', 'Angels', 'Reverence', 'Divinity', 'Virgin Mary', 'Christ Child', 'Castle', 'Landscape', 'Body Of Water', 'Flora', 'Renaissance']"
485,Saint Peter,"Marco Zoppo (Paduan, 1433-1478)",c. 1468,1468.0,1468.0,Tempera on poplar panel,NGA-bbedbb38-f641-4efe-b27a-f2e1139508a7,"https://api.nga.gov/iiif/bbedbb38-f641-4efe-b27a-f2e1139508a7/full/1686,/0/default.jpg","A serene depiction of Saint Peter with symbolic attributes, radiating spiritual solemnity.","The artwork portrays Saint Peter, one of the twelve apostles of Jesus Christ, recognized by his traditional iconographic attributes. He is depicted with a calm and reflective demeanor, holding the keys to the kingdom of heaven, a reference to the biblical passage where Jesus grants him this authority. Saint Peter's mature features, with a grey beard and contemplative eyes, are rendered with attention to detail.","Marco Zoppo's painting showcases the Italian Renaissance style with its precise representation of form and three-dimensional space. It features naturalistic human anatomy, fine detail in the facial features, and realistic drapery of the garments. The gilded background is indicative of the era's interest in creating an otherworldly, divine atmosphere, contrasting with the earthly realism of Saint Peter's figure.","['Italian Renaissance', 'Naturalism', 'Gold Leaf', 'Realism', 'Fine Detail', 'Iconography']","The painting's theme revolves around religious iconography, specifically the Christian tradition of venerating saints. It focuses on the symbolic portrayal of Saint Peter as the 'rock' of the Christian Church, emphasizing his role as a keeper of divine secrets and a foundational figure in the faith.","['Religion', 'Christian Iconography', 'Saints', 'Spirituality', 'Apostles', 'Biblical']","{'Saint Peter': 'Saint Peter is depicted with grey hair and beard, wearing a blue robe and a golden mantle, holding the keys to heaven.'}","['Keys', 'Golden background']",['Renaissance'],"['Saint Peter', 'Keys', 'Golden background']","['Italian Renaissance', 'Naturalism', 'Gold Leaf', 'Realism', 'Fine Detail', 'Iconography', 'Religion', 'Christian Iconography', 'Saints', 'Spirituality', 'Biblical', 'Renaissance']"
2445,The Ecstasy of Saint Francis,"Giovanni Baglione (Italian, 1566-1643)",1601,1601.0,1601.0,Oil on canvas,ARTIC-107dd824-9ae2-b091-9787-5901d5e300da,"https://www.artic.edu/iiif/2/107dd824-9ae2-b091-9787-5901d5e300da/full/1686,/0/default.jpg",A vivid illustration of spiritual rapture and divine revelation by Giovanni Baglione.,"The artwork portrays Saint Francis in a state of ecstasy, lying back with his eyes directed upward. Two angels hover over him, one holding a skull, signifying mortality, and the other loosely holding an arm around him. The saint appears to be in a moment of profound spiritual revelation or communion as suggested by his expression and posture. The realistic treatment of the figures and the use of light and shadow create a dramatic scene.","Giovanni Baglione's 'The Ecstasy of Saint Francis' exhibits the dynamic chiaroscuro and realism characteristic of the Baroque period. The artwork demonstrates a precise attention to physical details in the drapery and the human form, a naturalistic representation of the figures, and a dramatic use of light to evoke emotion and highlight certain elements of the composition. The contrast between light and dark areas, as well as the dynamic composition with angels leaning into the space, typify the Baroque style's emphasis on movement and emotion.","['Baroque', 'Chiaroscuro', 'Realism', 'Dramatic Lighting', 'Naturalism', 'Dynamic Composition']","This painting explores religious and mystical experience, depicting Saint Francis of Assisi, the patron saint of animals and nature, in a moment of divine ecstasy. It encapsulates the Catholic Church's Counter-Reformation ideals, emphasizing intense spiritual experiences and the possibility of personal communion with the divine. It also reflects on human mortality and the afterlife.","['Religion', 'Mysticism', 'Catholicism', 'Ecstasy', 'Saints', 'Divinity', 'Mortality', 'Afterlife']","{'Saint Francis': 'Saint Francis of Assisi is depicted in a brown robe, lying down, his gaze turned upward, symbolizing a spiritual vision or ecstasy.', 'Angels': ""Two angels are shown with Saint Francis; one cradles a skull, symbolizing mortality, while the other grips a crucifix, hinting at Christ's resurrection.""}","['Skull', 'Crucifix', 'Robe', 'Drapery']",['Baroque'],"['Saint Francis', 'Angels', 'Skull', 'Crucifix', 'Robe', 'Drapery']","['Baroque', 'Chiaroscuro', 'Realism', 'Dramatic Lighting', 'Naturalism', 'Dynamic Composition', 'Religion', 'Mysticism', 'Saints', 'Divinity', 'Mortality', 'Afterlife', 'Angels', 'Skull', 'Robe', 'Drapery']"
71,Saint Jerome and the Angel,"Simon Vouet (French, 1590-1649)",c. 1622/1625,1622.0,1625.0,Oil on canvas,NGA-8cb10467-fce1-444c-8412-168ec845b730,"https://api.nga.gov/iiif/8cb10467-fce1-444c-8412-168ec845b730/full/1686,/0/default.jpg",A divine encounter captured in this Baroque portrayal of inspiration and piety.,"The painting illustrates Saint Jerome, an elderly, bearded man, as he's visited by an angel. Jerome is shown half-draped in a rich red garment, writing on a piece of parchment, while the angel, in vibrant clothing with large wings, gently touches his shoulder and seems to whisper into his ear. A subdued palette dominates the scene, except for the strong contrasts of the figures' clothing.","Simon Vouet demonstrates the dramatic realism and dynamism characteristic of the Baroque period. The use of chiaroscuro, with highlighted forms emerging from dark backgrounds, and the naturalistic rendering of the figures showcase Vouet's talent in manipulating light and shadow to convey depth and emotion. The rich colors and detailed textures add to the sensual quality of the piece.","['Baroque', 'Chiaroscuro', 'Realism', 'Dynamism', 'Drama', 'Naturalism', 'Texture']","The subject of the artwork is religious, focusing on Saint Jerome, a church father known for translating the Bible into Latin (the Vulgate). This moment captures the spiritual guidance and inspiration he receives from the divine, symbolized through the angelic presence.","['Religious', 'Christianity', 'Inspiration', 'Divinity', 'Guidance', 'Saint']","{'Saint Jerome': 'A hermit-like figure deeply absorbed in his work, symbolizing scholarly devotion and divine inspiration.', 'Angel': 'A youthful, divine messenger draped in a flowing robe, embodying guidance and celestial intervention.'}","['parchment', 'inkwell', 'quill', 'garment', 'trumpet', 'book', 'skull', 'apple']",['Baroque'],"['Saint Jerome', 'Angel', 'parchment', 'inkwell', 'quill', 'garment', 'trumpet', 'book', 'skull', 'apple']","['Baroque', 'Chiaroscuro', 'Realism', 'Dynamism', 'Drama', 'Naturalism', 'Religious', 'Christianity', 'Inspiration', 'Divinity', 'Guidance', 'Saint', 'Saint Jerome', 'Angel', 'Inkwell', 'Quill', 'Garment', 'Book', 'Skull']"
